{
  "collected_at": "2026-09-08T00:00:00Z",
  "interval": {
    "end": "2026-09-08T00:00:00Z",
    "start": "2026-09-01T00:00:00Z"
  },
  "limits": {
    "maximum_pages_per_source": 2,
    "maximum_records_per_source": 50,
    "maximum_response_bytes": 2097152,
    "maximum_text_bytes": 512
  },
  "repository": "egohygiene/relay",
  "revision": "1111111111111111111111111111111111111111",
  "schema_version": "relay.repository-journal-evidence/v1",
  "sources": {
    "dependency_security": {
      "reason": null,
      "records": [],
      "status": "empty"
    },
    "merged_pull_requests": {
      "reason": null,
      "records": [
        {
          "id": "pull_request:900001",
          "kind": "pull-request-merged",
          "labels": [
            "feature"
          ],
          "observed_at": "2026-09-07T12:00:00Z",
          "state": "merged",
          "title": "Fixture journal change",
          "url": "https://github.com/egohygiene/relay/pull/900001"
        }
      ],
      "status": "complete"
    },
    "open_issues": {
      "reason": null,
      "records": [
        {
          "id": "issue:900002",
          "kind": "issue-open",
          "labels": [
            "feature"
          ],
          "observed_at": "2026-09-08T00:00:00Z",
          "state": "open",
          "title": "Fixture follow-up",
          "url": "https://github.com/egohygiene/relay/issues/900002"
        }
      ],
      "status": "complete"
    },
    "open_pull_requests": {
      "reason": null,
      "records": [],
      "status": "empty"
    },
    "releases": {
      "reason": null,
      "records": [],
      "status": "empty"
    },
    "workflow_runs": {
      "reason": null,
      "records": [
        {
          "id": "workflow_run:900003",
          "kind": "workflow-run",
          "labels": [],
          "observed_at": "2026-09-07T13:00:00Z",
          "state": "completed/success",
          "title": "Fixture validation",
          "url": "https://github.com/egohygiene/relay/actions/runs/900003"
        }
      ],
      "status": "complete"
    }
  }
}
